"Bread, Milk, Eggs"
"Milk, Beer, Laptop"
"Tissues, Deodorant, Milk, Water, Hoodie, Football"
"Diaper, Nerf gun, Shampoo, Tissues, Video Game"
"Highlighters, Donuts, Video Game, Milk"
"Eggs, Beer, Nerf gun, TV"
"PS5, Donuts"
"Yoga Mat, Lamp, Football, Shampoo, Conditioner, Lotion"
"Bread, Football, Eggs, Beer, Shampoo, Conditioner"
"Beer, Shampoo, Conditioner"
"Juice, Bacon, Lamp, Shampoo, Conditioner, Lotion"
"Lotion, Juice, Yoga Mat, Shampoo, Conditioner, Lotion"
"Donuts, PS5, Shampoo, Conditioner, Lotion"
"Highlighters, Eggs, Water, Shampoo, Conditioner"
"Water, TV, Lotion, Shampoo"
"Caviar, Shampoo, Conditioner, Basketball, Lotion"
"Hoodie, Water, Boots, Shampoo, Conditioner"
"Water, Caviar, Shampoo, Conditioner"
"Lamp, Laptop, Shampoo, Conditioner"
"Bacon, Juice, Dress Shirt, Shampoo, Conditioner"
