"Bacon, Juice, Milk, Eggs, TV, Water"
"Bread, Lamp, Eggs, TV, Water"
"Soda, Basketball, Juice, TV, Eggs, Water"
"Highlighters, Diaper, Bread, TV"
"Nerf gun, Highlighters, Eggs, TV"
"Deodorant, Eggs, TV, Water"
"Shampoo, Conditioner, Laptop, Lamp, Diaper, Milk, Eggs"
"Shampoo, Lamp, Water, Hoodie, Eggs, TV"
"Dress Shirt, Donuts, Eggs, TV"
"Juice, Beer, Caviar, Football, Eggs, TV, Water"
"Soda, Diaper, Bread, Lotion, Eggs, TV, Water"
"Lotion, Eggs, TV"
"Hoodie, TV, Football, Eggs"
"Basketball, Deodoarant, Water, Eggs, TV"
"Juice, Yoga Mat, TV, Football, Shampoo, Deodorant"
"Yoga Mat, Deodorant, Eggs, TV, Water"
"Yoga Mat, Eggs, TV"
"TV, Eggs, Water"
"PS5, TV, Conditioner, Milk, Eggs, Water"
"Milk, Eggs, TV, Water"
